{
  "schema_version": "2026-05-12",
  "artifact_class": "model_overlay",
  "generated_at_utc": "2026-05-12T21:14:55.386881+00:00",
  "source": {
    "canonical_dir": "runs\\evidence_resolver\\scored_batch\\resolved",
    "explorer_data_dir": "exect-explorer\\public\\data",
    "comparison_report": {
      "path": "runs\\evidence_resolver\\scored_batch\\comparison_report.json",
      "exists": true,
      "sha256": "e19696d03173033bf98fd7cfbb324585f56a8e9d6a4c4a61e3901e63f7b595e0"
    }
  },
  "model": {
    "model_id": "qwen3.6:35b",
    "model_label": "qwen_35b_local",
    "harness_id": "H6fs_benchmark_only_coarse_json",
    "pipeline_id": "H6fs_benchmark_only_coarse_json_relaxed_projection"
  },
  "documents": [
    {
      "document_id": "EA0008",
      "letter_path": "exect-explorer\\public\\data\\EA0008.json",
      "canonical_path": "runs\\evidence_resolver\\scored_batch\\resolved\\EA0008.json",
      "gold_entity_count": 7,
      "model_field_count": 7,
      "model_fields": [
        {
          "id": "current_anti_seizure_medications.0.name",
          "field_path": "fields.current_anti_seizure_medications[0].name",
          "field_group": "current_anti_seizure_medications",
          "value": "lamotrigine",
          "missingness": "present",
          "temporality": "current",
          "status": "current",
          "evidence": [
            {
              "quote": "Current anti-epileptic medication: lamotrigine 75mg bd (to reduce and stop as detailed below)",
              "char_start": 189,
              "char_end": 282,
              "valid_quote": true
            }
          ],
          "gold_candidates": [
            {
              "id": "T10",
              "type": "Prescription",
              "start": 189,
              "end": 254,
              "text": "Current-anti-epileptic-medication:-lamotrigine-75mg-bd-(to-reduce",
              "attributes": {
                "DrugName": "lamotrigine",
                "DrugDose": "75",
                "DoseUnit": "mg",
                "Frequency": "2",
                "CUIPhrase": "lamotrigine",
                "CUI": "C0064636"
              }
            }
          ],
          "alignment": {
            "status": "overlaps_gold",
            "note": "At least one evidence span overlaps a gold entity."
          }
        },
        {
          "id": "current_anti_seizure_medications.1.name",
          "field_path": "fields.current_anti_seizure_medications[1].name",
          "field_group": "current_anti_seizure_medications",
          "value": "levetiracetam",
          "missingness": "present",
          "temporality": "current",
          "status": "current",
          "evidence": [
            {
              "quote": "To start levetiracetam as detailed below",
              "char_start": 283,
              "char_end": 323,
              "valid_quote": true
            }
          ],
          "gold_candidates": [],
          "alignment": {
            "status": "evidence_only",
            "note": "Model has source evidence but no overlapping gold entity."
          }
        },
        {
          "id": "seizure_types.0.value",
          "field_path": "fields.seizure_types[0].value",
          "field_group": "seizure_types",
          "value": "focal seizure",
          "missingness": "present",
          "temporality": "current",
          "status": null,
          "evidence": [
            {
              "quote": "Seizure type and frequency: focal seizures with altered awareness every 3 weeks",
              "char_start": 108,
              "char_end": 187,
              "valid_quote": true
            }
          ],
          "gold_candidates": [
            {
              "id": "T8",
              "type": "SeizureFrequency",
              "start": 136,
              "end": 172,
              "text": "focal-seizures-with-altered-awarenes",
              "attributes": {
                "NumberOfSeizures": "1",
                "TimePeriod": "Week",
                "NumberOfTimePeriods": "3",
                "CUIPhrase": "focal-seizures-with-altered-awareness",
                "CUI": "C0270834"
              }
            },
            {
              "id": "T6",
              "type": "Diagnosis",
              "start": 136,
              "end": 173,
              "text": "focal-seizures-with-altered-awareness",
              "attributes": {
                "DiagCategory": "MultipleSeizures",
                "Certainty": "5",
                "Negation": "Affirmed",
                "CUIPhrase": "focal-seizures-with-altered-awareness",
                "CUI": "C0270834"
              }
            }
          ],
          "alignment": {
            "status": "overlaps_gold",
            "note": "At least one evidence span overlaps a gold entity."
          }
        },
        {
          "id": "current_seizure_frequency.value",
          "field_path": "fields.current_seizure_frequency.value",
          "field_group": "current_seizure_frequency",
          "value": null,
          "missingness": "not_stated",
          "temporality": "uncertain",
          "status": null,
          "evidence": [],
          "gold_candidates": [],
          "alignment": {
            "status": "not_present",
            "note": "Model did not mark this field present."
          }
        },
        {
          "id": "epilepsy_diagnosis.value",
          "field_path": "fields.epilepsy_diagnosis.value",
          "field_group": "epilepsy_diagnosis",
          "value": "focal epilepsy",
          "missingness": "present",
          "temporality": "current",
          "status": null,
          "evidence": [
            {
              "quote": "Diagnosis: symptomatic structural focal epilepsy",
              "char_start": 10,
              "char_end": 58,
              "valid_quote": true
            }
          ],
          "gold_candidates": [
            {
              "id": "T2",
              "type": "Diagnosis",
              "start": 21,
              "end": 58,
              "text": "symptomatic-structural-focal-epilepsy",
              "attributes": {
                "DiagCategory": "Epilepsy",
                "Certainty": "5",
                "Negation": "Affirmed",
                "CUIPhrase": "symptomatic-structural-focal-epilepsy",
                "CUI": "C0472349"
              }
            }
          ],
          "alignment": {
            "status": "overlaps_gold",
            "note": "At least one evidence span overlaps a gold entity."
          }
        },
        {
          "id": "eeg.result",
          "field_path": "fields.eeg.result",
          "field_group": "eeg",
          "value": "not_stated",
          "missingness": "not_stated",
          "temporality": "uncertain",
          "status": "not_stated",
          "evidence": [],
          "gold_candidates": [],
          "alignment": {
            "status": "not_present",
            "note": "Model did not mark this field present."
          }
        },
        {
          "id": "mri.result",
          "field_path": "fields.mri.result",
          "field_group": "mri",
          "value": "not_stated",
          "missingness": "not_stated",
          "temporality": "uncertain",
          "status": "not_stated",
          "evidence": [],
          "gold_candidates": [],
          "alignment": {
            "status": "not_present",
            "note": "Model did not mark this field present."
          }
        }
      ]
    },
    {
      "document_id": "EA0016",
      "letter_path": "exect-explorer\\public\\data\\EA0016.json",
      "canonical_path": "runs\\evidence_resolver\\scored_batch\\resolved\\EA0016.json",
      "gold_entity_count": 11,
      "model_field_count": 5,
      "model_fields": [
        {
          "id": "seizure_types.0.value",
          "field_path": "fields.seizure_types[0].value",
          "field_group": "seizure_types",
          "value": "focal seizure",
          "missingness": "present",
          "temporality": "current",
          "status": null,
          "evidence": [
            {
              "quote": "Diagnosis:\t single focal seizure",
              "char_start": 22,
              "char_end": 54,
              "valid_quote": true
            }
          ],
          "gold_candidates": [
            {
              "id": "T2",
              "type": "Diagnosis",
              "start": 41,
              "end": 54,
              "text": "focal-seizure",
              "attributes": {
                "DiagCategory": "SingleSeizure",
                "Certainty": "5",
                "Negation": "Affirmed",
                "CUIPhrase": "focal-seizure",
                "CUI": "C0751495"
              }
            }
          ],
          "alignment": {
            "status": "overlaps_gold",
            "note": "At least one evidence span overlaps a gold entity."
          }
        },
        {
          "id": "current_seizure_frequency.value",
          "field_path": "fields.current_seizure_frequency.value",
          "field_group": "current_seizure_frequency",
          "value": null,
          "missingness": "not_stated",
          "temporality": "uncertain",
          "status": null,
          "evidence": [],
          "gold_candidates": [],
          "alignment": {
            "status": "not_present",
            "note": "Model did not mark this field present."
          }
        },
        {
          "id": "epilepsy_diagnosis.value",
          "field_path": "fields.epilepsy_diagnosis.value",
          "field_group": "epilepsy_diagnosis",
          "value": null,
          "missingness": "not_stated",
          "temporality": "uncertain",
          "status": null,
          "evidence": [],
          "gold_candidates": [],
          "alignment": {
            "status": "not_present",
            "note": "Model did not mark this field present."
          }
        },
        {
          "id": "eeg.result",